{
  "case_id": "incident-report-001",
  "schema_version": "0.1.0",
  "artifact_type": "incident_report",
  "domain": "incident-report",
  "title": "API Latency Incident Report",
  "patient": { "age": 0, "sex": "X" },
  "status": "resolved",
  "summary": "API latency incident was caused by an exhausted connection pool after a deploy.",
  "required_documentation_count": 4,
  "facts": {
    "incident_status": { "label": "Incident status", "value": "resolved" },
    "root_cause": { "label": "Root cause", "value": "exhausted connection pool" },
    "start_time": { "label": "Start time", "value": "09:42 UTC" },
    "next_action": { "label": "Next action", "value": "add pool saturation alert" },
    "accessibility_mutation": { "label": "Accessibility mutation active", "value": false },
    "security_mutation": { "label": "Security mutation active", "value": false }
  },
  "evidence": [
    { "id": "ev-001", "title": "Latency alert fired at 09:42 UTC", "included": true },
    { "id": "ev-002", "title": "Deploy completed at 09:37 UTC", "included": true },
    { "id": "ev-003", "title": "Database pool saturation reached 100 percent", "included": true }
  ],
  "sections": [
    { "id": "timeline", "title": "Timeline", "claims": [{ "id": "claim-001", "text": "The incident began at 09:42 UTC.", "evidence": ["ev-001"] }, { "id": "claim-002", "text": "The deploy preceded the latency alert.", "evidence": ["ev-002"] }] },
    { "id": "root_cause", "title": "Root Cause", "claims": [{ "id": "claim-003", "text": "The root cause was an exhausted connection pool.", "evidence": ["ev-003"] }] }
  ],
  "diagram": { "edges": [{ "from": "deploy", "to": "connection_pool", "label": "increases demand" }, { "from": "connection_pool", "to": "api_latency", "label": "saturates" }, { "from": "api_latency", "to": "alert", "label": "triggers" }] },
  "risks": [{ "id": "risk-001", "label": "Pool saturation recurs without alerting", "severity": "high" }, { "id": "risk-002", "label": "Deploy rollback playbook remains manual", "severity": "medium" }],
  "questions": ["What is the incident status?", "What caused the incident?", "When did the incident begin?", "What action is needed next?", "Which risk has high severity?"]
}
